{
  "$schema": "https://json-schema.org/draft/2020-12/schema",
  "description": "A structured topology dataset with named arrays for each topological dimension. Points carry explicit coordinates; all higher-order features (edges, faces, shells, solids) use null geometry with topology defined via references or directed_references. Each array is restricted to its corresponding building block schema.",
  "$defs": {
    "PointFeatures": {
      "$anchor": "PointFeatures",
      "type": "array",
      "items": {
        "properties": {
          "geometry": {
            "type": "object",
            "required": [
              "type",
              "coordinates"
            ],
            "properties": {
              "type": {
                "type": "string",
                "const": "Point"
              },
              "coordinates": {
                "type": "array",
                "minItems": 2
              }
            }
          }
        },
        "required": [
          "geometry"
        ]
      }
    },
    "EdgeFeatures": {
      "$anchor": "EdgeFeatures",
      "type": "array",
      "items": {
        "allOf": [
          {
            "$ref": "bblocks://ogc.geo.topo.features.topo-line"
          },
          {
            "properties": {
              "topology": {
                "properties": {
                  "references": {
                    "minItems": 2,
                    "maxItems": 2
                  }
                }
              }
            }
          }
        ]
      }
    },
    "SolidOrAggregate": {
      "$anchor": "SolidOrAggregate",
      "description": "A solids-array entry: either a Solid bounded by its own Shells, or an AggregateSolid combining a set of member Solids by plain reference.",
      "oneOf": [
        {
          "$ref": "bblocks://ogc.geo.topo.features.topo-solid"
        },
        {
          "$ref": "bblocks://ogc.geo.topo.features.topo-aggregate-solid"
        }
      ]
    },
    "RingFeature": {
      "$anchor": "RingFeature",
      "$ref": "bblocks://ogc.geo.topo.features.topo-ring"
    },
    "FaceFeature": {
      "$anchor": "FaceFeature",
      "$ref": "bblocks://ogc.geo.topo.features.topo-face"
    },
    "ShellFeature": {
      "$anchor": "ShellFeature",
      "$ref": "bblocks://ogc.geo.topo.features.topo-shell"
    }
  },
  "type": "object",
  "required": [
    "type"
  ],
  "properties": {
    "type": {
      "type": "string",
      "const": "FeatureCollection"
    },
    "metadata": {
      "type": "object",
      "description": "Optional dataset metadata (units, coordinate precision, source info, etc.)",
      "additionalProperties": true
    },
    "points": {
      "type": "array",
      "description": "Point features providing base coordinate geometry for the topology",
      "items": {
        "oneOf": [
          {
            "$ref": "#PointFeatures"
          },
          {
            "allOf": [
              {
                "$ref": "bblocks://ogc.geo.topo.features.topo-feature-collection#FeatureCollectionOptions"
              },
              {
                "properties": {
                  "features": {
                    "$ref": "#PointFeatures"
                  }
                }
              }
            ]
          }
        ]
      }
    },
    "edges": {
      "oneOf": [
        {
          "$ref": "#EdgeFeatures"
        },
        {
          "type": "array",
          "description": "Edge (LineString) features referencing two point nodes via topology.references.",
          "items": {
            "allOf": [
              {
                "$ref": "bblocks://ogc.geo.topo.features.topo-feature-collection#FeatureCollectionOptions"
              },
              {
                "properties": {
                  "features": {
                    "$ref": "#EdgeFeatures"
                  }
                }
              }
            ]
          }
        }
      ]
    },
    "rings": {
      "type": "array",
      "description": "Ring features whose boundary segments reference edges via directed_references. geometry is null.",
      "items": {
        "oneOf": [
          {
            "$ref": "#RingFeature"
          },
          {
            "allOf": [
              {
                "$ref": "bblocks://ogc.geo.topo.features.topo-feature-collection#FeatureCollectionOptions"
              },
              {
                "properties": {
                  "features": {
                    "type": "array",
                    "items": {
                      "$ref": "#RingFeature"
                    }
                  }
                }
              }
            ]
          }
        ]
      }
    },
    "faces": {
      "type": "array",
      "description": "Face features whose boundary rings reference edges via directed_references. geometry is null.",
      "items": {
        "oneOf": [
          {
            "$ref": "#FaceFeature"
          },
          {
            "allOf": [
              {
                "$ref": "bblocks://ogc.geo.topo.features.topo-feature-collection#FeatureCollectionOptions"
              },
              {
                "properties": {
                  "features": {
                    "type": "array",
                    "items": {
                      "$ref": "#FaceFeature"
                    }
                  }
                }
              }
            ]
          }
        ]
      }
    },
    "shells": {
      "type": "array",
      "description": "Shell features referencing faces via directed_references. geometry is null.",
      "items": {
        "oneOf": [
          {
            "$ref": "#ShellFeature"
          },
          {
            "allOf": [
              {
                "$ref": "bblocks://ogc.geo.topo.features.topo-feature-collection#FeatureCollectionOptions"
              },
              {
                "properties": {
                  "features": {
                    "type": "array",
                    "items": {
                      "$ref": "#ShellFeature"
                    }
                  }
                }
              }
            ]
          }
        ]
      }
    },
    "solids": {
      "type": "array",
      "description": "Solid features whose shells reference faces via directed_references, or AggregateSolid features combining a set of member Solids by plain reference. geometry is null.",
      "items": {
        "oneOf": [
          {
            "$ref": "#SolidOrAggregate"
          },
          {
            "allOf": [
              {
                "$ref": "bblocks://ogc.geo.topo.features.topo-feature-collection#FeatureCollectionOptions"
              },
              {
                "properties": {
                  "features": {
                    "type": "array",
                    "items": {
                      "$ref": "#SolidOrAggregate"
                    }
                  }
                }
              }
            ]
          }
        ]
      }
    }
  }
}
