{
  "type": "FeatureCollection",
  "metadata": {
    "units": "meters",
    "coordinate_precision": 3,
    "conversion_factor": 0.0254
  },
  "points": [
    {
      "type": "FeatureCollection",
      "features": [
        {
          "id": "uuid:ad6d8fcc-402c-482e-8f1a-7492ccaead38",
          "type": "Feature",
          "geometry": {
            "type": "Point",
            "coordinates": [
              18.0,
              10.0,
              3.0
            ]
          },
          "properties": null
        },
        {
          "id": "uuid:8d2be28b-8f31-46de-99cb-4d8709502cd0",
          "type": "Feature",
          "geometry": {
            "type": "Point",
            "coordinates": [
              18.0,
              10.0,
              6.0
            ]
          },
          "properties": null
        },
        {
          "id": "uuid:c611f840-2829-44b2-b367-3915ca7875a4",
          "type": "Feature",
          "geometry": {
            "type": "Point",
            "coordinates": [
              18.0,
              2.0,
              6.0
            ]
          },
          "properties": null
        },
        {
          "id": "uuid:fad324b9-801f-40f4-b65b-91f8753e9698",
          "type": "Feature",
          "geometry": {
            "type": "Point",
            "coordinates": [
              18.0,
              2.0,
              3.0
            ]
          },
          "properties": null
        },
        {
          "id": "uuid:a0ec1bfd-0f7a-4c42-bc71-bacdcd44071d",
          "type": "Feature",
          "geometry": {
            "type": "Point",
            "coordinates": [
              12.0,
              2.0,
              3.0
            ]
          },
          "properties": null
        },
        {
          "id": "uuid:11caaac5-b631-4bd8-a6af-f82cb6371071",
          "type": "Feature",
          "geometry": {
            "type": "Point",
            "coordinates": [
              12.0,
              2.0,
              6.0
            ]
          },
          "properties": null
        },
        {
          "id": "uuid:5e08b82a-8efb-447c-b5c2-54f8ff5788b3",
          "type": "Feature",
          "geometry": {
            "type": "Point",
            "coordinates": [
              10.0,
              10.0,
              6.0
            ]
          },
          "properties": null
        },
        {
          "id": "uuid:22138e52-65ef-4773-b69d-5ea2628fad7b",
          "type": "Feature",
          "geometry": {
            "type": "Point",
            "coordinates": [
              10.0,
              10.0,
              3.0
            ]
          },
          "properties": null
        },
        {
          "id": "uuid:62a26df3-3e19-49bf-9ee4-24dbeb814a70",
          "type": "Feature",
          "geometry": {
            "type": "Point",
            "coordinates": [
              10.0,
              6.0,
              6.0
            ]
          },
          "properties": null
        },
        {
          "id": "uuid:8087116e-84cc-44d1-8047-78dc3837d7e8",
          "type": "Feature",
          "geometry": {
            "type": "Point",
            "coordinates": [
              12.0,
              6.0,
              6.0
            ]
          },
          "properties": null
        },
        {
          "id": "uuid:f34d9f2e-4180-41de-a613-46f78f4c178f",
          "type": "Feature",
          "geometry": {
            "type": "Point",
            "coordinates": [
              10.0,
              6.0,
              3.0
            ]
          },
          "properties": null
        },
        {
          "id": "uuid:87373f95-ee4b-4471-9980-f4a8258ee1e3",
          "type": "Feature",
          "geometry": {
            "type": "Point",
            "coordinates": [
              12.0,
              6.0,
              3.0
            ]
          },
          "properties": null
        },
        {
          "id": "uuid:e7300a01-f8c1-4351-9511-02790a5376b0",
          "type": "Feature",
          "geometry": {
            "type": "Point",
            "coordinates": [
              2.0,
              10.0,
              3.0
            ]
          },
          "properties": null
        },
        {
          "id": "uuid:1e20237c-9dfa-4251-9f3f-cc5e56a5becd",
          "type": "Feature",
          "geometry": {
            "type": "Point",
            "coordinates": [
              2.0,
              10.0,
              6.0
            ]
          },
          "properties": null
        },
        {
          "id": "uuid:307b7db6-8014-4628-b80e-ff925bf71168",
          "type": "Feature",
          "geometry": {
            "type": "Point",
            "coordinates": [
              2.0,
              2.0,
              3.0
            ]
          },
          "properties": null
        },
        {
          "id": "uuid:3c08ae4e-7b27-4e95-8bfb-6b42451be8f6",
          "type": "Feature",
          "geometry": {
            "type": "Point",
            "coordinates": [
              2.0,
              2.0,
              6.0
            ]
          },
          "properties": null
        },
        {
          "id": "uuid:b8412dad-b40a-4e35-9f42-f983e0fce39d",
          "type": "Feature",
          "geometry": {
            "type": "Point",
            "coordinates": [
              8.0,
              2.0,
              3.0
            ]
          },
          "properties": null
        },
        {
          "id": "uuid:9a1d8124-ca37-4abd-b07e-bff4c8eaa2f9",
          "type": "Feature",
          "geometry": {
            "type": "Point",
            "coordinates": [
              8.0,
              2.0,
              6.0
            ]
          },
          "properties": null
        },
        {
          "id": "uuid:caa6045e-4189-4571-8914-1189e51ac71e",
          "type": "Feature",
          "geometry": {
            "type": "Point",
            "coordinates": [
              8.0,
              6.0,
              6.0
            ]
          },
          "properties": null
        },
        {
          "id": "uuid:1d2a5d01-8547-4de6-abea-8f9ab994d35e",
          "type": "Feature",
          "geometry": {
            "type": "Point",
            "coordinates": [
              8.0,
              6.0,
              3.0
            ]
          },
          "properties": null
        },
        {
          "id": "uuid:ff685e16-64f8-4f41-8a9e-7d8e83312fd6",
          "type": "Feature",
          "geometry": {
            "type": "Point",
            "coordinates": [
              12.0,
              0.0,
              0.0
            ]
          },
          "properties": null
        },
        {
          "id": "uuid:92bd9ed9-c138-45c3-b72c-a9ecb7f7cfe9",
          "type": "Feature",
          "geometry": {
            "type": "Point",
            "coordinates": [
              20.0,
              0.0,
              0.0
            ]
          },
          "properties": null
        },
        {
          "id": "uuid:c060c1dc-6544-4595-b583-72ecf603fd6d",
          "type": "Feature",
          "geometry": {
            "type": "Point",
            "coordinates": [
              20.0,
              0.0,
              3.0
            ]
          },
          "properties": null
        },
        {
          "id": "uuid:7fe8cb9b-976e-4344-bf72-f3721d878ba4",
          "type": "Feature",
          "geometry": {
            "type": "Point",
            "coordinates": [
              12.0,
              0.0,
              3.0
            ]
          },
          "properties": null
        },
        {
          "id": "uuid:20d3c864-4a8c-4440-b600-a1d424e92f51",
          "type": "Feature",
          "geometry": {
            "type": "Point",
            "coordinates": [
              20.0,
              10.0,
              0.0
            ]
          },
          "properties": null
        },
        {
          "id": "uuid:2b34e214-cba7-4a66-8443-ceb932c5ef09",
          "type": "Feature",
          "geometry": {
            "type": "Point",
            "coordinates": [
              20.0,
              10.0,
              3.0
            ]
          },
          "properties": null
        },
        {
          "id": "uuid:16c35df5-bc63-4edd-8da5-dbcc5548a61e",
          "type": "Feature",
          "geometry": {
            "type": "Point",
            "coordinates": [
              10.0,
              10.0,
              0.0
            ]
          },
          "properties": null
        },
        {
          "id": "uuid:206806a4-a2f8-4c04-858e-99d289858a40",
          "type": "Feature",
          "geometry": {
            "type": "Point",
            "coordinates": [
              12.0,
              6.0,
              0.0
            ]
          },
          "properties": null
        },
        {
          "id": "uuid:d8d136c6-604c-4ad3-adf7-b0a7e04d034a",
          "type": "Feature",
          "geometry": {
            "type": "Point",
            "coordinates": [
              10.0,
              6.0,
              0.0
            ]
          },
          "properties": null
        },
        {
          "id": "uuid:b6d10150-f9d4-4f7e-b028-c4bbee8e7717",
          "type": "Feature",
          "geometry": {
            "type": "Point",
            "coordinates": [
              0.0,
              0.0,
              0.0
            ]
          },
          "properties": null
        },
        {
          "id": "uuid:a3b19f96-9bca-4c31-ac7e-4cb1615878df",
          "type": "Feature",
          "geometry": {
            "type": "Point",
            "coordinates": [
              8.0,
              0.0,
              0.0
            ]
          },
          "properties": null
        },
        {
          "id": "uuid:793997c5-bcc4-4610-984b-6cf2c2997348",
          "type": "Feature",
          "geometry": {
            "type": "Point",
            "coordinates": [
              8.0,
              0.0,
              3.0
            ]
          },
          "properties": null